shortname,question_title,type,page,place
space_use_dashboards,Do you use any dashboards or reporting solutions at work?,RADIO,48,2
rust_missed_ftrs,What Rust features do you miss the most in IDEs?,CHECKBOX,35,2
work_day_start,What time do you usually start your working day?,RADIO,53,5
rust_how_debug,How do you usually debug your Rust code?,RADIO,35,3
edu_pl,What programming languages have you studied at your educational institution?,CHECKBOX,50,4
edu_tools_adviced,"Which of the following tools do your teachers / professors advise you to use, if any?",CHECKBOX,50,5
lifestyle_creative,It is important to this person to think up new ideas and be creative; to do things one’s own way,RADIO,61,1
lifestyle_money,It is important to this person to be rich; to have a lot of money and expensive things,RADIO,61,2
lifestyle_security,Living in secure surroundings is important to this person; to avoid anything that might be dangerous,RADIO,61,3
lifestyle_good_time,It is important to this person to have a good time; to “spoil” oneself.,RADIO,61,4
lifestyle_for_society,It is important to this person to do something for the good of society,RADIO,61,5
lifestyle_success,Being very successful is important to this person; to have people recognize one’s achievements,RADIO,61,6
lifestyle_adventure,Adventure and taking risks are important to this person; to have an exciting life,RADIO,61,7
lifestyle_proper_behav,It is important to this person to always behave properly; to avoid doing anything people would say is wrong,RADIO,61,8
lifestyle_ecology,Looking after the environment is important to this person; to care for nature and save life resources,RADIO,61,9
lifestyle_traditions,Tradition is important to this person; to follow the customs handed down by one’s religion or family,RADIO,61,10
activities_kinds,In which kinds of activities are you involved?,CHECKBOX,4,5
target_platforms,For which platforms do you develop?,CHECKBOX,4,6
sw_types_developed,"What types of software do you develop (including apps in any programming language, for either professional or personal purposes)?",CHECKBOX,4,7
java_sw_developed,What types of software do you develop with Java?,CHECKBOX,19,12
c_sw_developed,What types of software do you  develop with С?,CHECKBOX,20,8
cpp_sw_developed,What types of software do you develop with C++?,CHECKBOX,21,14
mobile_ndevs_ios_andoid,How many developers work on your mobile application on both iOS and Android simultaneously (including yourself)?,RADIO,40,4
mobile_apps_functionality,Which of the following best describes the functionality of the mobile app you currently develop?,RADIO,40,5
mobile_apps_components,Which of the following components do you use in the mobile app you currently develop?,CHECKBOX,40,6
mobile_UI_native_imp,How important is it for you that your mobile app's UI has a native appearance?,RADIO,40,7
mobbile_UI_perfom_imp,How important is it for you that your mobile app's UI has a high performance?,RADIO,40,8
scala_use_dotty,Do you use or plan to use Scala 3 (Dotty)?,RADIO,30,8
scala_tools,What other tools do you use for Scala?,CHECKBOX,30,7
go_sw_peveloped,What types of software do you  develop with Go?,CHECKBOX,36,9
kotlin_jb_libs,"<span style=""font-size:16px;"">What JetBrains Kotlin libraries and frameworks do you currently use, if any?</span>",CHECKBOX,25,8
kotlin_libs,"<span style=""font-size:16px;"">What other Kotlin libraries and frameworks do you currently use, if any?</span>",CHECKBOX,25,9
mcrsrvc_do,Do you develop microservices? ,RADIO,42,4
cpp_move_11,"Do you plan to move from C++11 to another C++ standard in the next 12 months? If so, to which one?",RADIO,21,4
cpp_move_14,"Do you plan to move from C++14 to another C++ standard in the next 12 months? If so, to which one?",RADIO,21,5
cpp_move_17,"Do you plan to move from C++17 to another C++ standard in the next 12 months? If so, to which one?",RADIO,21,6
cpp_move_98,"Do you plan to move from C++98 / C++03 to another C++ standard in the next 12 months? If so, to which one?",RADIO,21,3
php_sw_developed,What types of software do you  develop with PHP?,CHECKBOX,24,15
salary,"What is your annual net (after tax) salary in USD, excluding any bonuses? (Optional)",RADIO,55,1
kotlin_ide,"<span style=""font-size:16px;"">What is your main IDE for Kotlin development?</span>",RADIO,25,14
space_tools_blogging,Which tools do you use in your company / organization for Internal Blogging?,CHECKBOX,48,20
space_tools_calendar,Which tools do you use in your company / organization for Calendar Management?,CHECKBOX,48,16
space_tools_employee,Which tools do you use in your company / organization as Employee Directory?,CHECKBOX,48,23
space_tooling_stack,Do you have any tooling stack/platform that your company/organization is tied to?,CHECKBOX,48,24
space_tools_code_review,Which tools do you use in your company / organization for Code Review?,CHECKBOX,48,8
space_tools_repo,Which tools do you use in your company / organization for Artifact / Repository Management?,CHECKBOX,48,7
country,What country do you live in?,MENU,5,3
space_tools_ci_2,Which tools do you use in your company / organization for Continuous Integration (CI)?,CHECKBOX,48,6
space_tools_projmanag_2,Which tools do you use in your company / organization for Project Management?,CHECKBOX,48,10
space_tools_vc_2,Which tools do you use in your company / organization for Version Control?,CHECKBOX,48,4
is_employed,Is employed? (generated),Fiction,,
primary,What are your primary programming languages? (generated),Fiction,,
rank,Please rank your primary programming languages by frequency of use (generated),Fiction,,
main,Main language (generated),Fiction,,
link,link (generated),Fiction,,
source,source (generated),Fiction,,
